PREGUNTA,RESPUESTA_A,RESPUESTA_B,RESPUESTA_C,RESPUESTA_D,RESPUESTA_CORRECTA,BLOQUE,AUTOR,PROMOCION,ANNO_CREACION,OBSERVACIONES,NUMERO_TEST,NUMERO_PREGUNTA,ID,TEMAS,REVISADA,ESTADO,REVISOR,SENTENCIA,,EXAMEN,ESTADO,,
Puede interponerse un recurso extraordinario de revisión:,"Ante actos firmes en la vía administrativa cuando al dictarlos se hubiera incurrido en error de hecho, que resulte de los propios documentos incorporados al expediente","Ante actos firmes en la vía administrativa cuando en la resolución hayan influido esencialmente documentos o testimonios declarados falsos por sentencia judicial firme, anterior o posterior a aquella resolución","Ante actos firmes en la vía administrativa cuando la resolución se hubiese dictado como consecuencia de prevaricación, cohecho, violencia, maquinación fraudulenta u otra conducta punible y se haya declarado así en virtud de sentencia judicial firme",Todas las anteriores son ciertas,D,BL,CMNG,PREPARATIC24,2016,Ley 39/2015,,,,8,2016,Revisada ,ASA,,,,,,
"Respecto a los contratos de colaboración entre el sector público y el sector privado, NO se incluyen entre las prestaciones que pueden ser objeto de estos contratos:","La construcción, instalación o transformación de obras, equipos, sistemas, y productos o bienes complejos, así como su mantenimiento, actualización o renovación, su explotación o su gestión.",La gestión integral del mantenimiento de instalaciones para la investigación.,La fabricación de bienes y la prestación de servicios que incorporen tecnología específicamente desarrollada con el propósito de aportar soluciones más avanzadas y económicamente más ventajosas que las existentes en el mercado.,Todas las anteriores pueden ser objeto de ese tipo de contratos.,B,BL,CSG,PREPARATIC24,2016,Dirección pública,,,,11,2016,Corregida,MJPP,Modificado el número de tema asignado,,,CORREGIDA,Cambio de número de tema,
"Dentro de la lógica presupuestaria, los ingresos tienen carácter...",Ejecutivo,Limitativo,Estimativo,Progresivo,C,BL,LGD,PREPARATIC24,2016,Presupuestos generales,,,,11,,,,,,,CORREGIDA,,
"Dentro de la lógica presupuestaria, los gastos tienen carácter...",Ejecutivo,Limitativo,Estimativo,Progresivo,B,BL,LGD,PREPARATIC24,2016,Presupuestos generales,,,,11,,,,,,,CORREGIDA,,
La partida presupuestaria es equivalente a...,El sujeto que realiza el gasto,El fin que se persigue con la realización del gasto,El dinero que se asigna a la realización del gasto,"El concepto del gasto, es decir: aquello en lo que se realiza el gasto",D,BL,LGD,PREPARATIC24,2016,Presupuestos generales,,,,11,,,,,,,CORREGIDA,,
El crédito presupuestario es...,El sujeto que realiza el gasto,El fin que se persigue con la realización del gasto,El dinero que se asigna a la realización del gasto,"El concepto del gasto, es decir: aquello en lo que se realiza el gasto",C,BL,LGD,PREPARATIC24,2016,Presupuestos generales,,,,11,,,,,,,CORREGIDA,,
Los Presupuestos Generales son expresión...,Cifrada,Conjunta,Sistemática,Todas son correctas,D,BL,LGD,PREPARATIC24,2016,Presupuestos generales,,,,11,,,,,,,CORREGIDA,,
"En los Presupuestos, ¿qué es lo que se prevé liquidar?",Los créditos,Las obligaciones,Los derechos,B y C son correctas,D,BL,LGD,PREPARATIC24,2016,Presupuestos generales,,,,11,,,,,,,CORREGIDA,,
"En términos familiares, podemos decir que desembocan en gastos...",Los créditos,Las partidas presupuestarias,Los derechos,Las obligaciones,D,BL,LGD,PREPARATIC24,2016,Presupuestos generales,,,,11,,,,,,,CORREGIDA,,
En las Administraciones Públicas...,Existe un Presupuesto ordinario únicamente,Existen sólo un presupuesto ordinario y un presupuesto extraordinario,Existe un único presupuesto ordinario y uno o varios presupuestos extraordinarios,Existen varios presupuestos que indistintamente pueden ser considerados ordinarios o extraordinarios,A,BL,LGD,PREPARATIC24,2016,Presupuestos generales,,,,11,,,,,,,CORREGIDA,,
El Presupuesto por programas sirve para saber...,En qué nos gastamos el dinero,Por qué nos gastamos el dinero,Para qué nos gastamos el dinero,Quién se gasta el dinero,C,BL,LGD,PREPARATIC24,2016,Presupuestos generales,,,,11,,,,,,,CORREGIDA,,
La clasificación económica del gasto nos dice...,En qué nos gastamos el dinero,Por qué nos gastamos el dinero,Para qué nos gastamos el dinero,Quién se gasta el dinero.,A,BL,LGD,PREPARATIC24,2016,Presupuestos generales,,,,11,,,,,,,CORREGIDA,,
"Según la Ley 47/2003, de 26 de noviembre, General Presupuestaria, los escenarios presupuestarios plurianuales contendrán la distribución orgánica de los recursos disponibles y se desarrollarán en programas plurianuales, referidos a:",a) Los cuatro ejercicios siguientes.,b) El ejercicio siguiente.,c) Los dos ejercicios siguientes.,d) Los tres ejercicios siguientes.,D,BL,LGD,PREPARATIC24,2016,Presupuestos generales,,,,11,,,,,,,CORREGIDA,,
"Según el artículo 44.3 de la Ley 47/2003, de 26 de noviembre, General Presupuestaria, los créditos para la acción protectora en su modalidad no contributiva y universal se especificarán:",A nivel de sección de programa.,A nivel de grupo de programa.,Ninguna de las respuestas es correcta.,A nivel de programa.,D,BL,LGD,PREPARATIC24,2016,Presupuestos generales,,,,11,,,,,,,CORREGIDA,,
"Según la Ley 47/2003, de 26 de noviembre, General Presupuestaria, el Intervención General de la Administración del Estado ejercerá sus funciones de control conforme a los principios de:","a) Autonomía, ejercicio desconcentrado y jerarquía externa.","b) Eficacia, ejercicio desconcentrado y jerarquía externa.","c) Autonomía, eficacia y ejercicio desconcentrado.","d) Autonomía, ejercicio desconcentrado y jerarquía interna.",D,BL,LGD,PREPARATIC24,2016,Presupuestos generales,,,,11,,,,,,,CORREGIDA,,
"Según el artículo 41 de la Ley 47/2003, de 26 de noviembre, General Presupuestaria, las operaciones financieras que se distinguen son:",Enajenación de inversiones reales y transferencias de capital.,Pasivos financieros y transferencias de capital.,Activos financieros y pasivos financieros.,Activos financieros y enajenación de inversiones reales.,C,BL,LGD,PREPARATIC24,2016,Presupuestos generales,,,,11,,,,,,,CORREGIDA,,
"De conformidad con el artículo 11 de la Ley 47/2003, de 26 de noviembre, General Presupuestaria, los derechos de naturaleza pública de la Hacienda Pública estatal se adquieren y nacen de conformidad con lo establecido en:","La Ley 47/2003, de 26 de noviembre, General Presupuestaria.","La Ley 6/1997, Organización y Funcionamiento de la AGE.",La normativa reguladora de cada derecho.,"Ley 50/1997, del Gobierno.",C,BL,LGD,PREPARATIC24,2016,Presupuestos generales,,,,11,,,,,,,CORREGIDA,,
"De acuerdo con la Ley 47/2003, de 26 de noviembre, General Presupuestaria, a quién le corresponde aprobar y comprometer los gastos propios de los servicios a su cargo:",A los ministros.,Las respuestas a) y b) son correctas.,Las respuestas a) y b) no son correctas.,A los titulares de los órganos del Estado.,B,BL,LGD,PREPARATIC24,2016,Presupuestos generales,,,,11,,,,,,,CORREGIDA,,
"De acuerdo con lo establecido en la Ley General Presupuestaria, durante el ejercicio presupuestario no es posible modificar la cuantía y/o finalidad de los créditos contenidos en los presupuestos de gastos mediante:",Transferencias de crédito.,Incorporaciones de crédito.,Imputaciones de crédito.,Ampliaciones de crédito.,C,BL,LGD,PREPARATIC24,2016,Presupuestos generales,,,,11,,,,,,,CORREGIDA,,
"Según el artículo 26 de la Ley 47/2003, de 26 de noviembre, General Presupuestaria, la programación presupuestaria se regirá por los principios de:","Estabilidad presupuestaria, sostenibilidad financiera, eficacia, transparencia, eficiencia en la asignación y utilización de los recursos públicos, responsabilidad y lealtad institucional.","Estabilidad presupuestaria, sostenibilidad financiera, transparencia, eficiencia en la asignación y utilización de los recursos públicos, responsabilidad y lealtad institucional.","Estabilidad presupuestaria, sostenibilidad financiera, plurianualidad, transparencia, responsabilidad y lealtad institucional.","Estabilidad presupuestaria, sostenibilidad financiera, plurianualidad, transparencia, eficiencia en la asignación y utilización de los recursos públicos, responsabilidad y lealtad institucional.",D,BL,LGD,PREPARATIC24,2016,Presupuestos generales,,,,11,,,,,,,CORREGIDA,,
"Conforme a la Ley 47/2003, de 26 de noviembre, General Presupuestaria, ¿existe la posibilidad de comprometer gastos para ejercicios futuros?","Sí, pero respetando los siguientes porcentajes para cada uno de los ejercicios futuros: 70% para el primer ejercicio futuro y 50% para los demás.","No, los créditos presupuestarios se agotan con el fin del ejercicio presupuestario.","Sí, pero respetando los siguientes porcentajes para cada uno de los ejercicios futuros: 70% para el primer ejercicio posterior; 60% para el segundo y 50% para tercero y cuarto.","Sí, pero respetando los siguientes porcentajes para cada uno de los ejercicios futuros: 60% para el primer ejercicio futuro; 50% para el segundo y tercero y 40% para el cuarto.",C,BL,LGD,PREPARATIC24,2016,Presupuestos generales,,,,11,,,,,,,CORREGIDA,,
"Según la Ley 47/2003, de 26 de noviembre, General Presupuestaria, los programas plurianuales deberá de contener:",Las respuestas a) y b) son correctas.,Las respuestas a) y b) no son correctas.,Contenido coherente con los planes sectoriales.,Programas de actuación de existentes en el ámbito de cada departamento.,A,BL,LGD,PREPARATIC24,2016,Presupuestos generales,,,,11,,,,,,,CORREGIDA,,
"A tenor del artículo 34 de la Ley 47/2003, de 26 de noviembre, General Presupuestaria, el ejercicio presupuestario coincidirá:",Con el año anterior.,Con los tres años anteriores.,Con el año natural.,Con los dos años anteriores.,C,BL,LGD,PREPARATIC24,2016,Presupuestos generales,,,,11,,,,,,,CORREGIDA,,
"Según la Ley 47/2003, de 26 de noviembre, General Presupuestaria, el Ministro de Economía y Competitividad podrá autorizar a la Secretaría General del Tesoro y Política Financiera a realizar operaciones pasivas de préstamo a un plazo no superior a:",Tres meses.,Nueve meses.,Cuatro meses.,Seis meses.,A,BL,LGD,PREPARATIC24,2016,Presupuestos generales,,,,11,,,,,,,CORREGIDA,,
"De acuerdo con la Ley 47/2003, de 26 de noviembre, General Presupuestaria, elaborar la documentación estadístico-contable de carácter oficial del Sistema de la Seguridad Social es una competencia de:",El Ministerio de Hacienda.,El Ministerio de Economía.,La Intervención General de la Administración del Estado.,Ninguna de las respuestas es correcta.,C,BL,LGD,PREPARATIC24,2016,Presupuestos generales,,,,11,,,,,,,CORREGIDA,,
"Conforme a la Ley General Presupuestaria, la clasificación económica agrupará los créditos por capítulos separando las operaciones corrientes, las de capital, las financieras y el Fondo de Contingencia de ejecución presupuestaria. En los créditos para operaciones de capital se incluirán:",Las inversiones financieras y las transferencias de capital.,Las inversiones reales y financieras.,Las transferencias de capital y las transferencias corrientes.,Las transferencias de capital y las inversiones reales.,D,BL,LGD,PREPARATIC24,2016,Presupuestos generales,,,,11,,,,,,,CORREGIDA,,
"¿Quién remitirá a las Cortes Generales un informe trimestral acerca de la utilización del Fondo regulado en el Fondo de Contingencia de ejecución presupuestaria según la Ley 47/2003, de 26 de noviembre, General Presupuestaria?",El Ministro de Economía.,El Gobierno.,El Ministro de Hacienda y Función Pública.,El Presidente del Gobierno.,B,BL,LGD,PREPARATIC24,2016,Presupuestos generales,,,,11,,,,,,,CORREGIDA,,
"Según la Ley 47/2003, de 26 de noviembre, General Presupuestaria, la agrupación de los créditos en capítulos, artículos, conceptos y subconceptos corresponde a la clasificación:",Orgánica.,Contable.,Económica.,Por programas.,C,BL,LGD,PREPARATIC24,2016,Presupuestos generales,,,,11,,,,,,,CORREGIDA,,
"Según la Ley 47/2003, de 26 de noviembre, General Presupuestaria, la modalidad de auditoría cuyo objeto consiste en la verificación selectiva de la adecuación a la legalidad de la gestión presupuestaria, de contratación, personal, ingresos y gestión de subvenciones, así como de cualquier otro aspecto de la actividad económico financiero de las entidades auditadas se denomina:",Auditoría de sistemas y procedimientos de gestión económica y financiera.,Auditoría operativa.,Auditoría de cumplimiento.,"Auditoría de economía, eficacia y eficiencia.",C,BL,LGD,PREPARATIC24,2016,Presupuestos generales,,,,11,,,,,,,CORREGIDA,,
"Según el artículo de la Ley 47/2003, de 26 de noviembre, General Presupuestaria , el régimen económico y financiero del sector público estatal se regula en:","Ley 50/1997, del Gobierno.","La Ley 47/2003, de 26 de noviembre, General Presupuestaria.","La Ley 6/1997, Organización y Funcionamiento de la Administración General del Estado.",La Ley General de la Hacienda Pública.,B,BL,LGD,PREPARATIC24,2016,Presupuestos generales,,,,11,,,,,,,CORREGIDA,,
"Según la Ley 47/2003, de 26 de noviembre, General Presupuestaria, los interventores delegados serán designados entre funcionarios de los Cuerpos:",Cuerpo Superior de Interventores y Auditores del Estado.,Todas las respuestas son correctas.,Cuerpo Militar de Intervención de la Defensa.,Cuerpo Superior de Intervención y Contabilidad de Administración de la Seguridad Social.,B,BL,LGD,PREPARATIC24,2016,Presupuestos generales,,,,11,,,,,,,CORREGIDA,,
"De conformidad con el artículo 29.2 de la Ley 47/2003, de 26 de noviembre, General Presupuestaria, los programas plurianuales se remitirán:",Anualmente.,Ninguna de las respuestas es correcta.,Trimestralmente.,Semestralmente.,A,BL,LGD,PREPARATIC24,2016,Presupuestos generales,,,,11,,,,,,,CORREGIDA,,
"Conforme a la Ley General Presupuestaria, la aprobación de las normas reguladoras de los anticipos de caja fija mediante las que se indiquen los gastos que pueden ser satisfechos por dicho sistema y los créditos compete:",Al Gobierno.,Al Ministro de Hacienda y Función Pública.,A los Ministros y Presidentes o Directores de los Organismos autónomos en relación con sus respectivos ámbitos.,"A los Ministros en relación con sus respectivos Departamentos, incluyendo los Organismos autónomos que tengan adscritos.",C,BL,LGD,PREPARATIC24,2016,Presupuestos generales,,,,11,,,,,,,CORREGIDA,,
"Señale, de acuerdo con la Ley General Presupuestaria, cuál de las siguientes afirmaciones es correcta:",La Ley General Presupuestaria permite realizar trasferencias de crédito desde el Capítulo 6 de los Presupuestos generales del Estado al Capítulo 2.,Es competencia del Consejo de Ministros la autorización de generaciones de crédito.,Los créditos extraordinarios por necesidades surgidas en operaciones financieras se financian con Deuda Pública o con baja en otros créditos de la misma naturaleza.,Excepcionalmente tendrán la condición de ampliables los créditos destinados al pago de los salarios de los empleados públicos.,C,BL,LGD,PREPARATIC24,2016,Presupuestos generales,,,,11,,,,,,,CORREGIDA,,
"Según la Ley 47/2003, de 26 de noviembre, General Presupuestaria, la función interventora se ejercerá en sus modalidades de:",Intervención física y general.,Intervención formal y material.,Intervención física y material.,Intervención formal y general.,B,BL,LGD,PREPARATIC24,2016,Presupuestos generales,,,,11,,,,,,,CORREGIDA,,
"Conforme a Ley 47/2003, de 26 de noviembre, General Presupuestaria, en el Presupuesto del Estado, los créditos destinados a atenciones protocolarias y representativas se especificarán:",A nivel de artículo.,A nivel de capítulo.,Al nivel que corresponda conforme a su concreta clasificación económica.,A nivel de concepto.,C,BL,LGD,PREPARATIC24,2016,Presupuestos generales,,,,11,,,,,,,CORREGIDA,,
"De acuerdo con la Ley 47/2003, de 26 de noviembre, General Presupuestaria, en el ámbito del Ministerio de Defensa y de la Seguridad Social, el control se ejercerá a través de:",La Intervención General de la Seguridad Social.,La Intervención General de la Defensa.,Las respuestas a) b) no son correctas.,Las respuestas a) y b) son correctas.,D,BL,LGD,PREPARATIC24,2016,Presupuestos generales,,,,11,,,,,,,CORREGIDA,,
"A tenor del artículo 48 de la Ley 47/2003, de 26 de noviembre, General Presupuestaria, podrá ser diferido el vencimiento de la obligación de pago del precio de compra de bienes inmuebles adquiridos directamente cuyo importe excede de:",Cuatro millones de euros.,Seis millones de euros.,Siete millones de euros.,Cinco millones de euros.,B,BL,LGD,PREPARATIC24,2016,Presupuestos generales,,,,11,,,,,,,CORREGIDA,,
"De acuerdo con el artículo 67 de la Ley 47/2003, de 26 de noviembre, General Presupuestaria, si las variaciones afectasen al volumen de endeudamiento a corto y largo plazo, será competencia del Consejo de Ministros cuando su importe exceda de la cuantía de:",12.000.000 euros de las cifras aprobadas en su presupuesto de capital.,13.000.000 euros de las cifras aprobadas en su presupuesto de capital.,11.000.000 euros de las cifras aprobadas en su presupuesto de capital.,10.000.000 euros de las cifras aprobadas en su presupuesto de capital.,A,BL,LGD,PREPARATIC24,2016,Presupuestos generales,,,,11,,,,,,,CORREGIDA,,
"La Ley 47/2003, de 26 de noviembre, General Presupuestaria se encuentra formada por:",180 artículos.,182 artículos.,185 artículos.,190 artículos.,B,BL,LGD,PREPARATIC24,2016,Presupuestos generales,,,,11,,,,,,,CORREGIDA,,
"Según la Ley 47/2003, de 26 de noviembre, General Presupuestaria, dirigir la contabilidad de las entidades que integran el sistema de la Seguridad Social y gestionar la contabilidad de las entidades gestoras y servicios comunes de la Seguridad Social es una función de:",El Ministerio de Hacienda y Función Pública.,La Intervención General de la Seguridad Social.,La Intervención General de la Administración del Estado.,La Intervención General de la Defensa.,B,BL,LGD,PREPARATIC24,2016,Presupuestos generales,,,,11,,,,,,,CORREGIDA,cambio  de respuesta,
"Señale la respuesta incorrecta respecto de la Ley 47/2003, de 26 de noviembre, General Presupuestaria:",El principio de dotación presupuestaria implica que los Presupuestos Generales del Estado de cada ejercicio contendrán los créditos necesarios para atender a las transferencias de medios económicos que deban realizarse a las comunidades autónomas por aplicación del sistema de financiación vigente en cada momento.,Los créditos para hacer efectivas las liquidaciones definitivas de ejercicios anteriores tendrán el carácter de ampliables.,El reintegro de ayudas y la responsabilidad financiera derivados de la gestión de los fondos procedentes de la Unión Europea se someterá a lo previsto en la Ley General de Subvenciones y en la normativa comunitaria.,"Los anticipos para ejecución de acciones y programas financiados o cofinanciados por fondos europeos que estuvieran pendientes de cancelar al finalizar el ejercicio, no podrán cancelarse en el ejercicio siguiente.",D,BL,LGD,PREPARATIC24,2016,Presupuestos generales,,,,11,,,,,,,CORREGIDA,,
"Conforme a la Ley 47/2003, de 26 de noviembre, General Presupuestaria, la prescripción de los derechos de la Hacienda Pública estatal, se interrumpirá conforme a lo establecido en:",La Ley General Tributaria.,La Ley Presupuestaria.,La Ley de Hacienda Pública.,Ninguna de las respuestas es correcta.,A,BL,LGD,PREPARATIC24,2016,Presupuestos generales,,,,11,,,,,,,CORREGIDA,,
"Según el artículo 56.6 de la Ley 47/2003, de 26 de noviembre, General Presupuestaria, el Ministro de Hacienda dará cuentas trimestralmente de los créditos extraordinarias y suplementos de crédito a:",Las Cortes Generales.,El Ministerio de Hacienda y Función Pública.,El Gobierno.,El Congreso de los Diputados.,A,BL,LGD,PREPARATIC24,2016,Presupuestos generales,,,,11,,,,,,,CORREGIDA,,
"Según la Ley 47/2003, de 26 de noviembre, General Presupuestaria, autorizar las transferencias entre distintas secciones presupuestarias como consecuencia de reorganizaciones administrativas, es una competencia de:",El Ministro de Hacienda y Función Pública.,El Gobierno.,El Presidente del Gobierno.,El Consejo de Ministros.,B,BL,LGD,PREPARATIC24,2016,Presupuestos generales,,,,11,,,,,,,CORREGIDA,,
"A tenor del artículo 47.2 de la Ley 47/2003, de 26 de noviembre, General Presupuestaria, el número de ejercicios a que pueden aplicarse los gastos no será superior a:",Dos.,Cuatro.,Cinco.,Tres.,B,BL,LGD,PREPARATIC24,2016,Presupuestos generales,,,,11,,,,,,,CORREGIDA,,
"De acuerdo con la Ley 47/2003, de 26 de noviembre, General Presupuestaria, la obligación de pagar los intereses de la Deuda del Estado y la de devolver los capitales llamados a reembolso, contados respectivamente a partir del vencimiento de los intereses y del día del llamamiento a reembolso prescribirá:",A los cinco años.,A los dos años.,A los tres años.,A los cuatro años.,A,BL,LGD,PREPARATIC24,2016,Presupuestos generales,,,,11,,,,,,,CORREGIDA,,
"Según Ley 47/2003, de 26 de noviembre, General Presupuestaria, el conjunto de gastos que se considera necesario realizar en el desarrollo de actividades orientadas a la consecución de determinados objetivos preestablecidos es:",Un programa presupuestario.,Un concepto presupuestario.,Una aplicación presupuestaria.,Un crédito presupuestario.,A,BL,LGD,PREPARATIC24,2016,Presupuestos generales,,,,11,,,,,,,CORREGIDA,,
"El Régimen Jurídico de la Deuda del Estado se encuentran regulados en la Ley 47/2003, de 26 de noviembre, General Presupuestaria:","Título V, Capítulo II, Sección 4.","Título V, Capítulo I, Sección 2.","Título IV, Capítulo II, Sección 3.","Título IV, Capítulo II, Sección 4.",C,BL,LGD,PREPARATIC24,2016,Presupuestos generales,,,,11,,,,,,,CORREGIDA,,
"Según la Ley 47/2003, de 26 de noviembre, General Presupuestaria, inspeccionar la actividad de las oficinas de contabilidad de las entidades gestoras y servicios comunes de la Seguridad Social es una competencia de:",El Ministerio de Hacienda y Función Pública.,La Intervención General de la Defensa.,La Intervención General de la Administración del Estado.,La Intervención General de la Seguridad Social.,C,BL,LGD,PREPARATIC24,2016,Presupuestos generales,,,,11,,,,,,,CORREGIDA,,
"Según la Ley General Presupuestaria, con carácter excepcional podrán generar crédito en el Presupuesto del ejercicio los ingresos realizados:",Por reembolso de préstamos.,Por la venta de bienes.,En el último trimestre del ejercicio anterior.,Por prestación de servicios.,C,BL,LGD,PREPARATIC24,2016,Presupuestos generales,,,,11,,,,,,,CORREGIDA,,
"Según el artículo 13.2 de la Ley 47/2003, de 26 de noviembre, General Presupuestaria, el aplazamiento y fraccionamiento de las cantidades adeudadas a la Hacienda Pública estatal por las comunidades autónomas y las corporaciones locales se regirá por:",La Ley General Tributaria.,"La Ley 6/1997, Organización y Funcionamiento de la Administración General del Estado.","La legislación específica, la cual tendrá en cuenta la necesaria reciprocidad entre administraciones.","La Ley 47/2003, de 26 de noviembre, General Presupuestaria.",C,BL,LGD,PREPARATIC24,2016,Presupuestos generales,,,,11,,,,,,,CORREGIDA,,
"A los efectos de la Ley 47/2003, de 26 de noviembre, General Presupuestaria , forman parte del sector público estatal:",Las respuestas a) y b) son correctas.,Los organismos autónomos dependientes de la Administración General del Estado.,"Las entidades públicas empresariales, dependientes de la Administración General del Estado, o de cualesquiera otros organismos públicos vinculados o dependientes de ella.",Las respuestas a) y b) no son correctas.,A,BL,LGD,PREPARATIC24,2016,Presupuestos generales,,,,11,,,,,,,CORREGIDA,,
"Las Obligaciones de la Hacienda Pública Estatal se encuentran regulados en la Ley 47/2003, de 26 de noviembre, General Presupuestaria:","Título II, Capítulo I, Sección 1.","Título I, Capítulo II, Sección 3.","Título I, Capítulo I, Sección 4.","Título I, Capítulo II, Sección 4.",D,BL,LGD,PREPARATIC24,2016,Presupuestos generales,,,,11,,,,,,,CORREGIDA,,
"Según la Ley 47/2003, de 26 de noviembre, General Presupuestaria, la Deuda Pública podrá estar representada en:",En títulos-valores.,Las respuestas a) y b) son correctas.,Las respuestas a) y b) no son correctas.,En cuenta.,B,BL,LGD,PREPARATIC24,2016,Presupuestos generales,,,,11,,,,,,,CORREGIDA,,
"A tenor de la Ley 47/2003, de 26 de noviembre, General Presupuestaria, la cuantía global de los anticipos de caja fija no podrá superar para cada ministerio y organismo autónomo:",El 7% del total de créditos del capítulo destinado a gastos corrientes en bienes y servicios del presupuesto vigente en cada momento.,El 5% del total de créditos del capítulo destinado a gastos corrientes en bienes y servicios del presupuesto vigente en cada momento.,El 6% del total de créditos del capítulo destinado a gastos corrientes en bienes y servicios del presupuesto vigente en cada momento.,El 8% del total de créditos del capítulo destinado a gastos corrientes en bienes y servicios del presupuesto vigente en cada momento.,A,BL,LGD,PREPARATIC24,2016,Presupuestos generales,,,,11,,,,,,,CORREGIDA,,
"Conforme a la Ley 47/2003, de 26 de noviembre, General Presupuestaria, el programa plurianual de la Seguridad Social se elaborará por:",El presidente de las Cortes Generales.,El Presidente del Gobierno.,El Ministro de Hacienda y Función Pública.,El Ministro de Trabajo y Asuntos Sociales.,D,BL,LGD,PREPARATIC24,2016,Presupuestos generales,,,,11,,,,,,,CORREGIDA,,
