PREGUNTA,RESPUESTA_A,RESPUESTA_B,RESPUESTA_C,RESPUESTA_D,RESPUESTA_CORRECTA,BLOQUE,AUTOR,PROMOCION,ANNO_CREACION,OBSERVACIONES,NUMERO_TEST,NUMERO_PREGUNTA,ID,TEMAS,REVISADA,ESTADO,REVISOR,SENTENCIA,,EXAMEN,ESTADO,,
Señale la respuesta correcta en relación a los diagramas de flujos de datos (DFD):,Una entidad externa se puede conectar directamente a un almacén de datos.,Los almacenes permiten crear y transformar datos.,Los procesos primitivos son aquellos procesos que no necesitan más descomposición.,Loos flujos de datos que comunican procesos pueden ser únicamente de diálogo.,C,B3,EMA,PREPARATIC24,2016,AGE A2 2015,,,,86,,,,,,AGE A2 2015,,,
En el lenguaje de modelado UML :,"Los diagramas de secuencia y colaboración son usados para modelar el comportamiento del sistema, pudiendo usarse para modelar un caso de uso, una clase, o un método complicado.",Los diagramas de actividad son usados para modelar la configuración de los elementos de procesado en tiempo de ejecución.,"Los diagramas de componentes son usados para modelar la estructura del software, incluyendo las dependencias entre los componentes de software.",Los diagramas de implementación son usados para modelar interacciones entre objetos de diseño en el sistema.,C,B3,A.deGrado,PREPARATIC24,2016,AGE A1 2015,,,11793,89,,,,,,AGE A1 2015,,,11793
"Bajo el paradigma de la Programación Orientada a Objetos, indique cuál de las siguientes proposiciones es falsa:",Los objetos se generan a partir de la instanciación de una clase.,El polimorfismo es la propiedad por la que es posible enviar mensajes sintácticamente iguales a objetos de tipos distintos.,Una clase abstracta puede ser extendida mediante el mecanismo de herencia.,La implementación de una interfaz no se considera polimorfismo.,D,B3,A.deGrado,PREPARATIC24,2016,AGE A1 2015,,,11885,89,,,,,,AGE A1 2015,,,11885
El patrón de diseño Fachada (Facade) es del tipo:,Estructural.,De comportamiento.,De prototipado.,Creacional.,A,B3,EMA,PREPARATIC24,2016,AGE A2 2015,,,,89,,,,,,AGE A2 2015,,,
"Señale cuál de los siguientes se corresponde con un patrón de diseño, usado en la arquitectura Java EE que se emplea para localizar de forma transparente y uniforme los componentes de negocio, abstrayendo la utilización de JNDI y ocultando la complejidad de la creación del contexto inicial:",Service Activator.,Service Locator.,Intercepting Filter.,Front Controller.,B,B3,EMA,PREPARATIC24,2016,AGE A2 2015,,,,89,,,,,,AGE A2 2015,,,
Cuál de los siguientes NO es un patrón de diseño de comportamiento:,Interpreter.,Mediator.,Composite.,Iterator.,C,B3,EMA,PREPARATIC24,2016,AGE A2 2015,,,,89,,,,,,AGE A2 2015,,,
Indique cuál de las siguientes afirmaciones es correcta:,"En el Diseño Orientado a Objetos, deben llevarse a cabo las siguientes actividades: la identificación de clases semánticas, atributos y servicios; identificación de las relaciones entre clases; el emplazamiento de las clases, atributos y servicios; la especificación del comportamiento dinámico mediante paso de mensajes.","En el Diseño Orientado a Objetos, deben llevarse a cabo las siguientes actividades: añadir las clases interfaz, base y utilidad; refinar las clases semánticas.","En el Análisis Orientado a Objetos, deben llevarse a cabo las siguientes actividades: toma inicial de requisitos; análisis; diseño; implementación.",Ninguna de las respuestas anteriores es correcta.,B,B3,LGD,PREPARATIC24,2016,Junta de Extremadura A1 2015,,,,89,,,,,,Junta de Extremadura A1 2015,,,
"Según el paradigma de Orientación a Objetos, la herencia posibilita que:",Cualquier cambio en los datos y operaciones contenidas dentro de una superclase es heredado inmediatamente por todas las subclases que se derivan de la superclase.,Cualquier cambio en las operaciones y datos de la superclase no se refleja en todas las subclases.,Cualquier cambio en una de las subclases que se heredan de la superclase se refleja en sus clases hermanas.,En el paradigma de Orientación a Objetos no existe la herencia.,A,B3,LGD,PREPARATIC24,2016,Junta de Extremadura A1 2015,,,,89,,,,,,Junta de Extremadura A1 2015,,,
En UML ¿qué es una máquina de estados?,"Es un modelo computacional representado por grafos, en los que los estados son los vértices.",Es un dispositivo que puede ser programado para cumplir determinadas tareas de control en sistema automáticos.,"Es un comportamiento que especifica las secuencias de estados por las que pasa un objeto a lo largo de su vida en respuesta a eventos, junto con sus respuestas a esos eventos.","Es un sistema lógico que posee una entrada, un procesador intermedio y una salida resultado de la aplicación del procesamiento sobre la entrada.",C,B3,LGD,PREPARATIC24,2016,Junta de Extremadura A1 2015,,,,89,,,,,,Junta de Extremadura A1 2015,,,
¿Cuál de los siguientes procesos de MÉTRICA Versión 3 no está dentro del ámbito de la norma ISO 12207 de procesos de ciclo de vida del software?,Planificación de Sistemas de Información,Desarrollo de Sistemas de Información,Construcción de Sistemas de Información,"Ninguno de los anteriores, ya que los tres están cubiertos por la norma ISO 12207",A,B3,A.deGrado,PREPARATIC24,2016,AGE A1 2015,,,11796,91,,,,,,AGE A1 2015,,,11796
"Según la metodología MÉTRICA Versión 3, ¿qué tipo de diagrama tiene como objetivo principal la representación de los aspectos estáticos del sistema utilizando diversos mecanismos de abstracción?",Diagrama de clases,Diagrama de componentes,Diagrama de estructura,Diagrama de paquetes,A,B3,A.deGrado,PREPARATIC24,2016,AGE A1 2015,,,11878,91,,,,,,AGE A1 2015,,,11878
"En Métrica v3, la elaboración de un catálogo detallado de requisitos que describa de forma precisa el sistema de información, compete a personas con perfil:",Consultor.,Jefe de Proyecto.,Directivo.,Analista.,D,B3,EMA,PREPARATIC24,2016,AGE A2 2015,,,,91,,,,,,AGE A2 2015,,,
"Según métrica v3, ¿cuál de las siguientes afirmaciones es correcta?",La ejecución de las pruebas unitarias se puede hacer simultáneamente con la ejecución de las pruebas del sistema.,La ejecución de las pruebas de integración se puede hacer a la vez que los manuales de usuario.,La ejecución de las pruebas de integración no se puede llevar a cabo hasta haber terminado la ejecución de las pruebas unitarias.,La definición de la formación a los usuarios finales no se puede llevar a cabo hasta haber terminado la elaboración de manuales de usuario.,B,B3,EMA,PREPARATIC24,2016,AGE A2 2015,,,,91,,,,,,AGE A2 2015,,,
"Según la metodología Métrica v3, el entorno tecnológico del sistema, es un producto del proceso:",Construcción del Sistema de Información.,Análisis del Sistema de Información.,Diseño del Sistema de Información.,Implantación y Aceptación del Sistema.,C,B3,EMA,PREPARATIC24,2016,AGE A2 2015,,,,91,,,,,,AGE A2 2015,,,
"Según Métrica v3, la figura de 'usuario experto' se engloba dentro del perfil:",Jefe de Proyecto.,Consultor.,Directivo.,Analista.,C,B3,EMA,PREPARATIC24,2016,AGE A2 2015,,,,91,,,,,,AGE A2 2015,,,
"En Métrica v3, indique la tarea englobada dentro de la actividad DSI 4 'Diseño de Clases':",Identificación de Clases Asociadas a un Caso de Uso.,Diseño de Módulos del Sistema.,Análisis de Consistencia de las Especificaciones de Diseño.,Diseño de la Jerarquía.,D,B3,EMA,PREPARATIC24,2016,AGE A2 2015,,,,91,,,,,,AGE A2 2015,,,
La ley cuya finalidad es reducir el acoplamiento en un sistema de información es la:,Ley de Amper.,Ley de Demeter.,Ley de Moore.,Ley de Hooke.,B,B3,EMA,PREPARATIC24,2016,AGE A2 2015,,,,91,,,,,,AGE A2 2015,,,
¿Cuál de las siguientes opciones muestra exclusivamente herramientas directamente relacionadas con la realización de pruebas para asegurar la calidad del software?,"JUnit, Artifactory y SonarQube","JUnit, Artifactory y Selenium","JUnit, SonarQube y Selenium","ArtiFactory, SonarQube y Selenium",C,B3,A.deGrado,PREPARATIC24,2016,AGE A1 2015,,,11881,92,,,,,,AGE A1 2015,,,11881
¿Cuál de los siguientes es un framework de pruebas para JavaScript?,ScriptTester.,Jspector.,JavaTester.,Qunit.,D,B3,EMA,PREPARATIC24,2016,AGE A2 2015,,,,92,,,,,,AGE A2 2015,,,
"La norma internacional cuyo objetivo es crear un estándar sobre pruebas de software que recoja y estandarice vocabulario, procesos, técnicas de documentación, etc. del ciclo de vida de las pruebas es:",ISO/IEC 25000,ISO/IEC 829,ISO/IEC/IEEE 29119,ISO/IEC 9126,C,B3,EMA,PREPARATIC24,2016,AGE A2 2015,,,,92,,,,,,AGE A2 2015,,,
¿Cuál de las siguientes herramientas NO se emplea para realizar pruebas de carga?,Loadrunner.,Jmeter.,Webserver Stress Tool.,Apache Turbine.,D,B3,EMA,PREPARATIC24,2016,AGE A2 2015,,,,92,,,,,,AGE A2 2015,,,
"Respecto a SonarQube, señale la opción FALSA:",Sirve para evaluar aspectos como la complejidad ciclomática del código.,Anteriormente se denominaba Sonar.,Permite disponer de una matriz de dependencia entre objetos.,"Integra herramientas de medición de la calidad de código como CPD, findbugs, PMD, checkstyle.",C,B3,LGD,PREPARATIC24,2016,Integración continua,,,,92,,,,,,,,,
Señale la opción correcta,Jenkins un servidor de integración continua comercial.,Extiende su funcionalidad a través de plugins.,"Solamente soporta herramientas de control de versiones como CVS, Gity Clearcase.",No posee un historial de cambios realizados por build o versión.,B,B3,LGD,PREPARATIC24,2016,Integración continua,,,,92,,,,,,,,,
"Señale de las siguientes la que NO corresponde a una herramienta de integración continua:
",Jenkins,Hudson,SonarQube,Todas lo son,D,B3,ADPA,PREPARATIC24,2016,Integración continua,,,,92,,,,,,,,,
De las siguientes cuál NO es una ventaja de la integración continua:,Ejecución inmediata de las pruebas de aceptación.,Monitorización continua de las métricas de calidad del proyecto.,"Los desarrolladores pueden detectar y solucionar problemas de integración de forma continua, evitando el caos de última hora cuando se acercan las fechas de entrega.","Disponibilidad constante de una versión para pruebas, demos o lanzamientos anticipados.",A,B3,ADPA,PREPARATIC24,2016,Integración continua,,,,92,,,,,,,,,
De las siguientes cuál está relacionada con la noción de integración continua:,Programación estructurada.,Metodología Métrica Versión 4.,Programación extrema.,Programación Espuria.,C,B3,ADPA,PREPARATIC24,2016,Integración continua,,,,92,,,,,,,,,
Señale el que corresponde a un principio de integración continua:,Migración manual y controlada a cada entorno de desarrollo,Mantener un repositorio de código.,Reutilización de interfaces de usuario.,Todos corresponden a principios de integración continua.,B,B3,ADPA,PREPARATIC24,2016,Integración continua,,,,92,,,,,,,,,
Cuál de las siguientes afirmaciones relativas a Apache Jenkins es falsa,Está desarrollado en Java.,Fue un proyecto escindido de Hudson tras una disputa con Oracle.,Se considera software libre bajo la licencia EUPL.,Todas las afirmaciones son correctas.,C,B3,ADPA,PREPARATIC24,2016,Integración continua,,,,92,,,,,,,,,
¿Qué es SonarQube?,Una métrica de calidad orientada a estandarizar la evaluación cualitativa del código fuente.,Una plataforma Open Source de inspección continua de la calidad del código.,"Una herramienta propietaria para la integración continua, integrada en Apache Jenkins.",Una herramienta multiplataforma para la evaluación de la calidad en el código desarrollada en VisualBasic 6.,C,B3,ADPA,PREPARATIC24,2016,Integración continua,,,,92,,,,,,,,,
¿Qué es la integración continua?,Una práctica recogida en la metodología Métrica V3.,Un modelo informático que consiste en hacer integraciones automáticas de un proyecto lo más a menudo posible para así poder detectar fallos cuanto antes.,Una metodología ágil inspirada en XP y FDD encaminada a realizar un desarrollo holístico en todo el proceso de desarrollo de un sistema de información.,Ninguna de las anteriores.,B,B3,ADPA,PREPARATIC24,2016,Integración continua,,,,92,,,,,,,,,
¿Cuál de los siguientes NO es un repositorio de código?,CVS,SVN,Team Foundation Server,Apache Tomcat,D,B3,ADPA,PREPARATIC24,2016,Integración continua,,,,92,,,,,,,,,
Señale la que NO corresponde a una herramienta de automatización de pruebas:,Selenium,JUnit,Jenkins,JMeter,C,B3,ADPA,PREPARATIC24,2016,Integración continua,,,,92,,,,,,,,,
En el modelo de integración continua se recomienda:,Mantener un repositorio de código.,Realizar una migración manual y controlada a cada entorno de desarrollo.,Realizar las construcciones de versiones agrupando múltiples commits para optimizar el tiempo de proceso.,Realizar las pruebas en el entorno de producción para obtener resultados reales.,B,B3,ADPA,PREPARATIC24,2016,Integración continua,,,,92,,,,,,,,,
Entre las funcionalidades generales de un servidor de integración continua NO se encuentra,"La ejecución de una serie de test: JUnit, Cactus, Auditoria del código fuente, test IHM, test funcionales.",Permite realiza el despliegue de archivos en el entorno de producción.,La notificación del resultado por medios como correo electrónico o RSS.,La creación de un informe de estadísticas.,B,B3,LGD,PREPARATIC24,2016,Integración continua,,,,92,,,,,,,,,
Señale la opción correcta,Jenkins un servidor de integración continua comercial.,Extiende su funcionalidad a través de plugins.,"Solamente soporta herramientas de control de versiones como CVS, Git y Clearcase.",No posee un historial de cambios realizados por build o versión.,B,B3,LGD,PREPARATIC24,2016,Integración continua,,,,92,,,,,,,,,
Son herramientas específicas de control de versiones de software:,"Mercurial, Git y Apache Subversion.","Gimp, Mercurial y Git.","RedMine, Planner y OpenProj.","Cassandra, Git y REDIS.",A,B3,LGD,PREPARATIC24,2016,TAI 2016.,,,,92,,,,,,TAI 2016.,,,
Las normas ISO que cubren los procesos de especificación de requisitos de calidad del software y evaluación de la calidad del software corresponden a la serie:,ISO/IEC 25000,ISO/IEC 27000,ISO 9000,ISO 9001,A,B3,A.deGrado,PREPARATIC24,2016,AGE A1 2015,,,11842,93,,,,,,AGE A1 2015,,,11842
Recientemente se ha publicado la norma de calidad ISO 9000:2015. Al igual que la ISO 9000:2008 se basa en principios. Indique de los siguientes cuál NO es un principio de la ISO 9000:2015:,Enfoque al cliente.,Liderazgo.,Gestión de las relaciones.,Enfoque al beneficio.,D,B3,EMA,PREPARATIC24,2016,AGE A2 2015,,,,93,,,,,,AGE A2 2015,,,
Señale la respuesta FALSA relativa a SQuaRE (Software Product Quality Requirements and Evaluation):,Permite la evaluación de la calidad del software.,Su certificación es complementaria a ISO/IEC 15504-SPICE.,Así se conoce a las normas de la familia ISO/IEC 25000.,Es un framework de programación de requisitos software.,D,B3,EMA,PREPARATIC24,2016,AGE A2 2015,,,,93,,,,,,AGE A2 2015,,,
El modelo CMMI v1.3 en su representación por etapas establece:,"4 niveles de capacidad que son: Incompleto, Realizado, Gestionado y Definido.","4 niveles de madurez que son: Inicial, Realizado, Gestionado cualitativamente y en optimización.","5 niveles de madurez que son: Inicial, Gestionado, Definido, Gestionado cualitatlvamente y en opllmizadón.","5 niveles de capacidad que son: Incompleto, Realizado, Definido, Gestionado cualitativamente y en optimización.",ANULADA,B3,EMA,PREPARATIC24,2016,AGE A2 2015,,,,93,,,,,,AGE A2 2015,,,
Indique alguna certificación en el ámbito empresarial que le cualifique profesionalmente para poder gestionar un proyecto de desarrollo:,CMP.,"Oracle Certified Associate, Java SE 8 Programmer Certification.",Certificación ISO 9001:2008.,PMP.,D,B3,EMA,PREPARATIC24,2016,AGE A2 2015,,,,94,,,,,,AGE A2 2015,,,
"Con respecto a los entornos de integración continua, indique cuál de las siguientes afirmaciones es cierta:",Jenkins no dispone de la funcionalidad de extenderse mediante plugins.,SonarQube utiliza herramientas de análisis estático de código que permiten obtener métricas para mejorar la calidad del código.,El fichero POM empleado en Maven no siempre es un fichero XML.,Jenkins es un software de integración continua bajo licencia Oracle.,B,B3,A.deGrado,PREPARATIC24,2016,AGE A1 2015,,,11799,95,,,,,,AGE A1 2015,,,11799
"Según el estándar IEEE 1219 para el mantenimiento del software, un cambio de tecnología pertenecería a un tipo de mantenimiento:",Preventivo.,Correctivo.,Perfectivo.,Adaptativo.,D,B3,EMA,PREPARATIC24,2016,AGE A2 2015,,,,96,,,,,,AGE A2 2015,,,
El método utilizado en el mantenimiento de software consistente en el examen y modificación de un sistema para reconstruirlo de una nueva forma es:,Ingeniería inversa.,Reestructuración software.,Reingeniería.,Transformación de programas.,C,B3,EMA,PREPARATIC24,2016,AGE A2 2015,,,,97,,,,,,AGE A2 2015,,,
Señale la respuesta correcta:,"La norma ISO 9004 está compuesta por las normas ISO 9000:2005, ISO 9002:2008 e ISO 9004:2009.","La norma ISO 9004:2009 se refiere a la gestión para el éxito sostenido de una organización, con un enfoque de gestión de la calidad.",La norma ISO 9004:2009 se refiere a los principios y vocabulario de los sistemas de gestión de calidad.,La norma ISO 9002:2008 se refiere a los requisitos de los sistemas de gestión de calidad.,B,B3,A.deGrado,PREPARATIC24,2016,AGE A1 2015,,,11804,98,,,,,,AGE A1 2015,,,11804
¿Cuál de los siguientes NO es un gestor de contenidos?,Drupal,Cassandra,Wordpress,OpenCMS,B,B3,A.deGrado,PREPARATIC24,2016,AGE A1 2015,,,11830,99,,,,,,AGE A1 2015,,,11830
¿Cuál de las siguientes herramientas NO es considerada un gestor documental?,OpenKM.,Adobe LiveCycle.,Alfresco.,Knowledge Tree.,B,B3,EMA,PREPARATIC24,2016,AGE A2 2015,,,,99,,,,,,AGE A2 2015,,,
¿Qué gestor de contenido emplea PHP como lenguaje de programación?,Liferay,Drupal,Plone,Magnolia,B,B3,EMA,PREPARATIC24,2016,AGE A2 2015,,,,99,,,,,,AGE A2 2015,,,
Señale cuál de los siguientes NO es uno de los principios de COBIT v5:,Satisfacer las necesidades de las partes interesadas.,Cubrir las necesidades del departamento de tecnologías de la información.,Habilitar un enfoque holístico.,Separar el gobierno de la gestión.,B,B3,A.deGrado,PREPARATIC24,2016,AGE A1 2015,,,11795,101,,,,,,AGE A1 2015,,,11795
"En ITIL v3, ¿cuál de los siguientes procesos forma parte del Diseño del Servicio?",Gestión de la disponibilidad,Gestión de la demanda,Gestión de entregas,Gestión de la configuración,A,B3,A.deGrado,PREPARATIC24,2016,AGE A1 2015,,,11811,101,,,,,,AGE A1 2015,,,11811
Con respecto a ITIL señale qué afirmación es cierta:,Constituye una metodología exhaustiva de pasos a seguir en el diseño de servicios TI.,"Da instrucciones de trabajo concretas, asignado tareas a personas.",Los organismos tecnológicamente más punteros de la Administración General del Estado se encuentran certificados en ITIL.,Constituye un conjunto de mejores prácticas para la gestión de servicios TI.,D,B3,A.deGrado,PREPARATIC24,2016,AGE A1 2015,,,11847,101,,,,,,AGE A1 2015,,,11847
Con respecto a la norma ISO/IEC 20000 de gestión de servicios TI:,Permite certificar a individuos a lo largo de diferentes niveles de conocimiento.,Impone el uso exclusivo de ITIL como metodología a seguir.,No permite validar la capacidad de un proveedor de servicios TI de gestionar efectivamente servicios TI.,Microsoft Operation Framework (MOF) puede ser usado para conseguir su cumplimiento.,D,B3,A.deGrado,PREPARATIC24,2016,AGE A1 2015,,,11849,101,,,,,,AGE A1 2015,,,11849
El modelo de capacidad de procesos establecido por COBIT v5:,No modifica esencialmente el modelo planteado por COBIT v4.1.,"Define 5 niveles de procesos (proceso incompleto, ejecutado, gestionado, predecible, optimizado).",El nivel 1 (proceso ejecutado) sólo se alcanza si el proceso alcanza su propósito.,Un proceso es optimizado si se ejecuta dentro de los límites definidos para alcanzar sus resultados de proceso.,C,B3,A.deGrado,PREPARATIC24,2016,AGE A1 2015,,,11850,101,,,,,,AGE A1 2015,,,11850
"Según ITILv3 , el objetivo principal del Diseño del Servicio es:",El diseño de servicios nuevos para su paso a un entorno de producción.,El diseño de servicios nuevos para su paso a un entorno seguro.,El diseño de servicios nuevos o modificados para su paso a un entorno seguro.,El diseño de servicios nuevos o modificados para su paso a un entorno de producción.,D,B3,LGD,PREPARATIC24,2016,Junta de Extremadura A1 2015,,,,101,,,,,,Junta de Extremadura A1 2015,,,
"ITIL v3, define:",Un proceso es un conjunto estructurado de actividades diseñado para cumplir un objetivo concreto.,Un proceso es un conjunto de actividades no estructuradas para cumplir un objetivo concreto.,Un proceso es toda actividad encaminada a cumplir con un estándar definido por las normas ISO.,Un proceso es un conjunto de actividades de documentación y seguridad diseñados mediante diagramas de flujo de información.,A,B3,LGD,PREPARATIC24,2016,Junta de Extremadura A1 2015,,,,101,,,,,,Junta de Extremadura A1 2015,,,
"En ITIL v3, entre los procesos de la “Fase del Ciclo de Vida: Diseño del Servicio”, están:",Gestión del Catálogo de Servicios y Gestión de la Cartera de Servicios.,Gestión de la Cartera de Servicio y Gestión de la Seguridad de la Información.,Gestión de la Disponibilidad y Gestión de la Capacidad.,Gestión de Suministradores y Gestión de Eventos.,C,B3,LGD,PREPARATIC24,2016,Junta de Extremadura A1 2015,,,,101,,,,,,Junta de Extremadura A1 2015,,,
"En ITIL v3, entre las metas del Proceso de la Planificación y Soporte de la Transición del Servicio, se incluye:",Planificar y coordinar recursos para garantizar el cumplimiento de las especificaciones de la mejora continua del servicio.,"Identificar, gestionar y limitar riesgos que puedan interrumpir el servicio a partir de la fase de transición del servicio.","Planificar, identificar y gestionar recursos para garantizar el cumplimiento de las especificaciones de la mejora continua del servicio.",Todas las respuestas son correctas.,B,B3,LGD,PREPARATIC24,2016,Junta de Extremadura A1 2015,,,,101,,,,,,Junta de Extremadura A1 2015,,,
En Itil V3 la Gestión de la Cartera de Servicios pertenece a la fase de ciclo de vida:,Diseño del servicio.,Transición del servicio.,Estrategia del servicio.,Operación del servicio.,C,B3,LGD,PREPARATIC24,2016,Junta de Extremadura A1 2015,,,,101,,,,,,Junta de Extremadura A1 2015,,,
En Itil v3 se diferencia entre la Gestión de la Cartera de Servicios y la Gestión del Catálogo de Servicios ya que:,La Cartera de Servicios contiene información sobre cada servicio y su estado.,La Cartera de Servicios es un subconjunto del Catálogo de Servicios.,"La Cartera de Servicios divide los servicios en componentes y contiene políticas, directrices y responsabilidades , así como precios, acuerdos de nivel de servicio y condiciones de entrega.",Todas las respuestas son correctas.,A,B3,LGD,PREPARATIC24,2016,Junta de Extremadura A1 2015,,,,101,,,,,,Junta de Extremadura A1 2015,,,
"En Itil V3, entre los factores que hay que tener en cuenta en la evaluación de herramientas de Gestión del Servicio se encuentran:","Estructura, tratamiento, integración de datos y cumplimiento de estándares internacionales.","structura, salvaguarda, integración de datos, flexibilidad de implementación, uso y comunicación de datos.","Estructura, tratamiento, inspección de datos y cumplimiento de estándares internacionales.","Responsabilidad, tratamiento, inspección de datos y soporte a la monitorización de los niveles de servicio.",A,B3,LGD,PREPARATIC24,2016,Junta de Extremadura A1 2015,,,,101,,,,,,Junta de Extremadura A1 2015,,,
Según la especificación del protocolo de encaminamiento BGP-4:,"En E-BGP, los prefijos que aprende un router de un vecino no pueden ser anunciados a otro vecino mediante I-BGP.",Un prefijo aprendido de un vecino mediante I-BGP no puede reanunciarse a otro vecino por I-BGP.,Es un protocolo que funciona sobre TCP por el puerto 169.,Es un protocolo que funciona sobre UDP por el puerto 169.,B,B4,EMA,PREPARATIC24,2016,AGE A2 2015,,,,102,,,,,,AGE A2 2015,,,
El algoritmo de grafos que resuelve el problema de encontrar los caminos más cortos a partir de un origen dado al resto de los vértices de un grafo pesado se denomina:,Algoritmo de Prim.,Algoritmo de Kruskal.,Algoritmo de Dijkstra.,Algoritmo de Floyd-Warshall.,C,B4,EMA,PREPARATIC24,2016,AGE A2 2015,,,,102,,,,,,AGE A2 2015,,,
¿Qué protocolo utiliza traceroute para obtener la ruta que se sigue desde nuestro equipo hasta otro en Internet?,Ping,ICMP,PPP,BGP,B,B4,EMA,PREPARATIC24,2016,AGE A2 2015,,,,102,,,,,,AGE A2 2015,,,
Un protocolo para la conexión entre sistemas autónomos es:,ELP4 (Exterior linking protocol).,SGP2 (Standalone gateway protocol).,BGP4 (Border gateway protocol).,SLP2 (Standalone linking protocol).,C,B4,EMA,PREPARATIC24,2016,AGE A2 2015,,,,102,,,,,,AGE A2 2015,,,
"En Internet, la entidad encargada de la coordinación de los Números de Sistema Autónomo (Autonomous System Numbers - ASN) usados por varios protocolos de enrutamiento, es:",IANA,ISOC,IETF,IAB,A,B4,A.deGrado,PREPARATIC24,2016,AGE A1 2015,,,11857,103,,,,,,AGE A1 2015,,,11857
Señale cuál de los siguientes es un lenguaje de consulta sobre grafos RDF en la web semántica:,RDFQL,SWL,SPARQL,SQLWS,C,B4,EMA,PREPARATIC24,2016,AGE A2 2015,,,,103,,,,,,AGE A2 2015,,,
"La web semántica utiliza mecanismos que ayudan a convertir la web en una infraestructura global en la que es posible compartir, y reutilizar datos y documentos entre diferentes tipos de usuarios. Indicar el INCORRECTO:",OWL,SPARQL,RDF,RSA,D,B4,EMA,PREPARATIC24,2016,AGE A2 2015,,,,103,,,,,,AGE A2 2015,,,
"La velocidad de transmisión del cable de pares trenzados CAT6 empleado en el cableado de redes locales, es de:",Hasta 56 Mbps.,Hasta 100 Mbps.,"Hasta 1,2 Gbps.",Hasta 10 Gbps.,C,B4,EMA,PREPARATIC24,2016,AGE A2 2015,,,,104,,,,,,AGE A2 2015,,,
