PREGUNTA,RESPUESTA_A,RESPUESTA_B,RESPUESTA_C,RESPUESTA_D,RESPUESTA_CORRECTA,BLOQUE,AUTOR,PROMOCION,ANNO_CREACION,OBSERVACIONES,NUMERO_TEST,NUMERO_PREGUNTA,ID,TEMAS,REVISADA,ESTADO,REVISOR,SENTENCIA,,EXAMEN,ESTADO,,
"Los medios y servicios compartidos, establecidos en el Real Decreto 806/2014 dentro del modelo de gobernanza en el ámbito de las tecnologías de la información y las comunicaciones de la Administración General del Estado, son tales que:","Su declaración presupone que el servicio se encuentra en producción, listo para la adhesión de las diferentes unidades departamentales.","Dado su carácter obligatorio y sustitutivo, no se permite acordar excepciones por razones económicas, técnicas o de oportunidad sobrevenidas.","Su declaración establece la habilitación para el desarrollo de las medidas técnicas, organizativas, presupuestarias y normativas.",Su provisión se realiza directa y exclusivamente por medio de la Dirección General de Administración Digital,C,B1,A.deGrado,PREPARATIC24,2016,AGE A1 2015,,,11791,26,2016,Revisada,A.deGrado,,He hecho referencia a la nueva Secretaría General de Administración Digital,AGE A1 2015,,,11791
¿Cuál de las siguientes NO es una función de la Secretaría General de Administración Digital?,Establecer los mecanismos que aseguren un adecuado mantenimiento del censo de activos TIC.,"El estudio y la implementación de modelos para incentivar la compartición y reutilización de las infraestructuras y aplicaciones sectoriales, y promover el desarrollo de aplicaciones bajo dicho modelo.","La supervisión y coordinación del registro de convenios del sector público estatal, de acuerdo con la información que deberán suministrar los diferentes departamentos ministeriales y demás organismos públicos suscriptores de los mismos.","El desarrollo, impulso e implantación de sistemas tecnológicos de apoyo para la gestión de recursos humanos, incluidos los sistemas del Registro Central de Personal.",C,B1,A.deGrado,PREPARATIC24,2016,AGE A1 2015,,,11798,26,2016,Revisada,A.deGrado,,He hecho referencia a la nueva Secretaría General de Administración Digital,AGE A1 2015,,,11798
¿Cuál es el órgano de la Comisión Europea encargado de la gobernanza TIC cuya misión es garantizar que la Comisión haga un uso eficaz de las tecnologías de la información y la comunicación para el logro de sus objetivos organizativos y políticos?,La Dirección General de Informática (DIGIT),Oficina del Organismo de Reguladores Europeos de las Comunicaciones Electrónicas (ORECE),Agencia de Seguridad de las Redes y de la Información de la Unión Europea (ENISA),Instituto Europeo de Innovación y Tecnología (EIT),A,B1,ASA,PREPARATIC24,2016,Gobernanza TIC,,,,26,,,,,,,,,
¿Qué estándar ISO define un marco de trabajo para la gobernanza TIC?,ISO/IEC 31000,ISO/IEC 14000,ISO/IEC 38500,ISO/IEC 18000,C,B1,ASA,PREPARATIC24,2016,Gobernanza TIC,,,,26,,,,,,,,,
¿Cuál es el órgano superior de gobernanza TIC en la Administración General del Estado?,El Comité de Dirección TIC,El Consejo Superior de Administración Electrónica,La Dirección de Tecnologías de la Información,La Comisión de Estrategia TIC,D,B1,ASA,PREPARATIC24,2016,Gobernanza TIC,,,,26,,,,,,,,,
"¿Cuál es la nueva denominación para la Dirección de Tecnologías de la Información tras la aprobación del Real Decreto 424/2016, de 11 de noviembre, por el que se establece la estructura orgánica básica de los departamentos ministeriales?","Subsecretaría de Energía, Turismo y Agenda Digital",Secretaría General de Administración Digital,Dirección General de Telecomunicaciones y Tecnologías de la Información,Secretaría de Estado de Administración Digital,B,B1,ASA,PREPARATIC24,2016,Gobernanza TIC,,,,26,,,,,,,,,
El principio definido en el estándar ISO/IEC 38500 para la Gobernanza TIC que establece la necesidad de cumplir los requerimientos regulatorios y legales es el principio de:,Conformidad,Responsabilidad,Adquisición,Desempeño,A,B1,ASA,PREPARATIC24,2016,Gobernanza TIC,,,,26,,,,,,,,,
"La gobernanza TIC incluye, entre otros, los siguientes aspectos:",Integrar la estrategia TIC con la de negocio,Adoptar e implantar un marco de control de las TIC,Proporcionar las estructuras organizativas encargadas de implantar la estrategia TIC,Todas las anteriores,D,B1,ASA,PREPARATIC24,2016,Gobernanza TIC,,,,26,,,,,,,,,
El ámbito de aplicación del RD 806/2014 de Gobernanza TIC es:,La Administración General del Estado,La Administración General del Estado y sus Organismos Públicos,La Administración General del Estado y sus Organismos Públicos y las Comunidades Autónomas,"La Administración General del Estado y sus Organismos Públicos, las Comunidades Autónomas y las Entidades Locales",B,B1,ASA,PREPARATIC24,2016,Gobernanza TIC,,,,26,,,,,,,,,
El presidente del pleno de la Comisión de Estrategia TIC es :,"El Ministro de Energía, Turismo y Agenda Digital",El Ministro de Hacienda y Función Pública,El Presidente del Gobierno,El Secretario General de Administración Digital,B,B1,ASA,PREPARATIC24,2016,Gobernanza TIC,,,,26,,,,,,,,,
Entre las funciones a desarrollar por la Comisión Sectorial de la administración electrónica NO se encuentra:,Asegurar la compatibilidad e interoperabilidad de los sistemas y aplicaciones empleados por las Administraciones Públicas.,Impulsar el desarrollo de la administración electrónica en España.,"Asegurar la cooperación entre las Administraciones Públicas para proporcionar información administrativa clara, actualizada e inequívoca.",El seguimiento de la ejecución del Plan de Transformación Digital,D,B1,ASA,PREPARATIC24,2016,Gobernanza TIC,,,,26,,,,,,,,,
"¿Cuál es el órgano técnico de cooperación de la Administración General del Estado, de las Administraciones de las Comunidades Autónomas y de las Entidades Locales en materia de administración electrónica definido en la ley 40/2015 de Régimen Jurídico del Sector Público?",La Conferencia Sectorial de Telecomunicaciones y Sociedad de la Información,El Comité Sectorial de Administración Electrónica,La Comisión Sectorial de administración electrónica,La Comisión de Estrategia TIC,C,B1,ASA,PREPARATIC24,2016,Gobernanza TIC,,,,26,,,,,,,,,
"Con respecto al ámbito objetivo de aplicación de la Ley 37/2007, de 16 de noviembre, sobre reutilización de la información del sector público:",Abarca el intercambio de documentos entre Administraciones y organismos del sector público en el ejercicio de las funciones públicas que tengan atribuidas.,Será aplicable incluso sobre los documentos que obran en las Administraciones y organismos del sector público para finalidades ajenas a sus funciones de servicio público.,No afecta a la existencia de derechos de propiedad intelectual de las Administraciones y organismos del sector público ni a su posesión por éstos.,"Fija la prevalencia del derecho fundamental a la protección de datos de carácter personal, aún cuando se apliquen medidas de disociación de datos.",C,B1,A.deGrado,PREPARATIC24,2016,AGE A1 2015,,,11810,27,,,,,,AGE A1 2015,,,11810
Indique la opción correcta en relación con la VISIÓN de la Estrategia TIC,En el año 2020 la Administración española ha de ser electrónica.,En el año 2020 la Administración española ha de ser digital.,Para el año 2020 ya no existirá ningún procedimiento en soporte papel.,En el año 2020 los funcionarios realizarán todas sus tareas con ordenador.,B,BL,AMB,PREPARATIC24,2016,Estrategia TIC,,,,28,2016,Revisada,CSG,,,,,,
Son líneas de acción del Plan de Transformación Digital de la AGE y sus OOPP.,Disponer de sistemas de análisis de datos para la toma de decisiones y de funcionarios formados adecuadamente.,Que en el año 2020 la Administración española ha de ser electrónica.,Un mejor formación del funcionariado y una atención al ciudadano acorde a las nuevas tecnologías.,Desarrollar el puesto de trabajo digital y mejorar la satisfacción del usuario en el uso de los servicios públicos digitales.,D,BL,AMB,PREPARATIC24,2016,Estrategia TIC,,,,28,2016,Revisada,CSG,,,,,,
En el Plan de Transformación Digital de la AGE y sus OOPP el principio de transparencia:,El seguimiento de la actividad de los funcionarios aumenta la eficacia de los servicios públicos.,La transparencia facilita al ciudadano el acceso a los servicios públicos.,"Una continua monitorización de la actividad, junto a la evaluación y difusión de resultados incrementa la satisfacción de los ciudadanos.",El seguimiento y control de la actividad política disminuye las actividades ligadas a la corrupción.,C,BL,AMB,PREPARATIC24,2016,Estrategia TIC,,,,28,2016,Revisada,CSG,,,,,,
Son principios rectores del Plan de Transformación Digital de la AGE y sus OOPP:,"Tranparencia, Innovación, Unidad y visión integral y Orientación al usuario del servicio","Tranparencia, Colaboración y alianzas, Orientación al usuario del servicio y Reutilización","Reutilización, Seguridad, Orientación al usuario del servicio y Transparencia",Ninguna de las anteriores,A,B1,AMB,PREPARATIC24,2016,Estrategia TIC,,,,28,2016,Revisada,CSG,,,,,,
Las iniciativas que se lancen al amparo del Plan de Acción de la Administración Electrónica de la UE se basarán en:,6 principios.,7 principios.,5 principios.,6 directrices.,C,B1,AMB,PREPARATIC24,2016,Estrategia TIC,,,,28,2016,Corregida,CSG,,,,,,
"En el Plan de Acción de la Administración Electrónica de la UE, las administraciones públicas y las instituciones públicas de la Unión Europea deben ser abiertas, eficaces e integradoras en el año:",2025,2023,2030,2020,D,B1,AMB,PREPARATIC24,2016,Estrategia TIC,,,,28,2016,Revisada,CSG,,,,,,
La estructura de la Estrategia TIC:,"5 principios rectores, 7 objetivos estratégicos, 9 líneas de acción","5 principios rectores, 5 objetivos estratégicos, 7 líneas de acción","5 principios rectores, 5 objetivos estratégicos, 9 líneas de acción","5 principios rectores, 6 objetivos estratégicos, 8 líneas de acción",C,B1,AMB,PREPARATIC24,2016,Estrategia TIC,,,,28,2016,Revisada,CSG,,,,,,
En relación al principio rector Orientación al usuario del servicio del Plan de Transformación Digital de la AGE y sus OOPP:,"Es necesario redefinir los servicios empezando por el lado del usuario, ya sea un ciudadano o un empleado público, con una vocación de accesibilidad, usabilidad, simplicidad y seguridad.","Es necesario redefinir los servicios empezando por el lado del ciudadano, ya sea un funcionario o una persona física, con una vocación de accesibilidad, usabilidad, simplicidad y transparencia.","Se requiere modernizar los servicios públicos empezando por el lado del ciudadano, ya sea un funcionario o una persona física, con una vocación de transparencia, usabilidad, simplicidad y accesibilidad.","Es necesario redefinir los servicios empezando por el lado del usuario, ya sea un ciudadano o un empleado público, con una vocación de accesibilidad, usabilidad, simplicidad y transparencia.",A,B1,AMB,PREPARATIC24,2016,Estrategia TIC,,,,28,2016,Revisada,CSG,,,,,,
Uno de los objetivos estratégicos del Plan de Transformación Digital de la AGE y sus OOPP:,Proveer de manera compartida servicios comunes,El canal digital ha de ser el medio preferido por ciudadanos y empresas para relacionarse con la Administración.,Orientación al usuario del servicio.,Transparencia,B,B1,AMB,PREPARATIC24,2016,Estrategia TIC,,,,28,2016,Revisada,CSG,,,,,,
Dos de los principios del Plan de Acción de la Administración Electrónica de la UE son:,Transparencia e innovación,Seguridad y reutilización,Reutilización y buzón de quejas y sugerencias,Principio de solo una vez y transfronterizo de forma predeterminada,D,B1,AMB,PREPARATIC24,2016,Estrategia TIC,,,,28,2016,Revisada,CSG,,,,,,
El concepto de Green CPD está muy avanzado y se está convirtiendo en un referente. Una de las técnicas utilizadas es el Free Cooling. ¿En qué consiste?,Utilizar software libre en el control de la climatización.,Utilizar temperaturas bajo cero para la climatización.,Se trata del pasillo frío.,Utilizar las bajas temperaturas del aire exterior para la climatización.,D,B1,EMA,PREPARATIC24,2016,AGE A2 2015,,,,30,,,,,,AGE A2 2015,,,
La estrategia de comunicación de un nuevo proyecto estratégico TIC NO debe:,Posponerse a la puesta en producción del proyecto sin incidencias significativas.,Presentar prototipos que muestren la evolución del desarrollo ya realizado.,Diseñar una campaña de difusión y promoción del proyecto.,Asegurar la implicación de representantes de todas las unidades afectadas.,A,B1,A.deGrado,PREPARATIC24,2016,AGE A1 2015,,,11792,31,,,,,,AGE A1 2015,,,11792
¿Cuál de los siguientes principios NO está recogido en el Manifiesto por el Desarrollo Ágil del Software?,"La simplicidad, o el arte de maximizar la cantidad de trabajo no realizado, es esencial.","Aceptamos que los requisitos cambien, incluso en etapas tardías del desarrollo. Los procesos ágiles aprovechan el cambio para proporcionar ventaja competitiva al cliente.","Las mejores arquitecturas, requisitos y diseños emergen por la aplicación de unos procesos bien organizados.",El software funcionando es la medida principal del progreso.,C,B1,A.deGrado,PREPARATIC24,2016,AGE A1 2015,,,11833,34,,,,,,AGE A1 2015,,,11833
¿Cúal es un objetivo de las metodologías lean?,Maximizar el valor para los clientes,Reducir los costes y aumentar la calidad del producto o del servicio, Entregar productos de manera más rápida,Todos los anteriores son objetivos de la metodología lean,D,B1,VMHB,PREPARATIC24,2016,Metodologias Lean,,,,34,2016,Revisada,MRM,,,,,,
¿A través de qué empresa surgen las metodologías lean?,Ford,Google,Toyota,Facebook,C,B1,VMHB,PREPARATIC24,2016,Metodologias Lean,,,,34,2016,Revisada,MRM,,,,,,
¿Quién es el responsable de transladar la metodología lean al software?,Eric Ries,Steve Blank,Tom Poppendieck,Alexander Osterwalder,C,B1,VMHB,PREPARATIC24,2016,Metodologias Lean,,,,34,2016,Revisada,MRM,,,,,,
¿Cúal de los siguientes puntos NO es uno de los principios de las metodologías lean?,Flexibilidad para variar el servicio o producto,Eliminar desperdicios,Decidir lo más tarde posible,Hacer entregas tan rápido como sea posible,A,B1,VMHB,PREPARATIC24,2016,Metodologias Lean,,,,34,2016,Revisada,MRM,,,,,,
¿Cúal de las siguientes NO es una metodología lean?,Lean startup,Business Model Canvas,Dynamic system Development method,Lean software development,C,B1,VMHB,PREPARATIC24,2016,Metodologias Lean,,,,34,2016,Revisada,MRM,,,,,,
"El artículo 102 del Real Decreto 1720/2007, por el que se determina la conservación de una copia de respaldo de los datos y de los procedimientos de recuperación de los mismos en un lugar diferente de aquel en que se encuentren los equipos informáticos que los tratan, ¿a qué nivel o niveles de medidas de seguridad es aplicable?",Básico,Medio,Alto,A los niveles medio y alto,C,B1,A.deGrado,PREPARATIC24,2016,AGE A1 2015,,,11852,35,,,,,,AGE A1 2015,,,11852
Las transferencias internacionales de datos de carácter personal:,Se regulan en los artículos 33 y 34 de la Ley Orgánica 15/1999 de Protección de Datos de Carácter Personal y en el Título VI del Real Decreto 1720/2007 por el que se aprueba el Reglamento de desarrollo de la Ley Orgánica 15/1999.,"Una transferencia internacional de datos, es un tratamiento de datos que supone una transmisión de los mismos fuera del territorio de la Unión Europea (UE).","La Decisión de la Comisión 2000/520/CE, con arreglo a la Directiva 95/46/CE, permite actualmente realizar transferencias de datos a Estados Unidos si se cumplen los principios del acuerdo de Puerto Seguro.","Precisan, en todo caso, la autorización previa de la Dirección de la Agencia Española de Protección de Datos.",A,B1,A.deGrado,PREPARATIC24,2016,AGE A1 2015,,,11865,35,,,,,,AGE A1 2015,,,11865
"En relación con la Ley Orgánica 15/1999, de 13 de diciembre, de protección de datos de carácter personal, señale la respuesta correcta:","En caso de datos de carácter personal registrados inexactos o incompletos, el interesado debe instar su rectificación, sin que puedan ser cancelados y sustituidos de oficio por los datos rectificados o completados.","En caso de datos de carácter personal registrados inexactos o incompletos, serán cancelados y sustituidos de oficio por los datos rectificados o completados, sin perjuicio del derecho de rectificación y cancelación del afectado.",El responsable del tratamiento tendrá la obligación de hacer efectivo el derecho de rectificación o cancelación del interesado en el plazo de 15 días.,El responsable del tratamiento tendrá la obligación de hacer efectivo el derecho de rectificación o cancelación del interesado en el plazo de 1 mes.,B,B1,A.deGrado,PREPARATIC24,2016,AGE A1 2015,,,11868,35,,,,,,AGE A1 2015,,,11868
De acuerdo con el Real Decreto 1720/2007 indique qué medida ha de ser aplicada obligatoriamente a los ficheros de los que sean responsables las Administraciones tributarias en el ejercicio de sus potestades tributarias:,Cifrado de las comunicaciones,"Al menos, una auditoría bienal (cada 2 años)",Registro de los accesos,No queda regulado en dicho Real Decreto al depender de la criticidad del fichero.,B,B1,A.deGrado,PREPARATIC24,2016,AGE A1 2015,,,11841,35,,,,,,AGE A1 2015,,,11841
"Según la Ley Orgánica 15/1999 de Protección de Datos de carácter personal, el director de la Agencia Española de Protección de Datos será nombrado, de entre quienes componen el Consejo Consultivo, por un periodo de:",5 años mediante Real Decreto.,2 años mediante Ley.,3 años mediante Orden Ministerial.,4 años mediante Real Decreto.,D,B1,EMA,PREPARATIC24,2016,AGE A2 2015,,,,35,,,,,,AGE A2 2015,,,
"Según la Ley de Protección de Datos de Carácter Personal, no podrán realizarse transferencias de datos de carácter personal a países que no proporcionen un nivel de protección equiparable al de esta Ley. ¿Quién se encarga de evaluar el nivel adecuado de protección que ofrece el país de destino de los datos?",El Ministerio de Asuntos Exteriores junto con el Ministerio de Justicia.,El responsable de la custodia de los datos enviados.,La Agencia Europea de Cooperación.,La Agencia de Protección de Datos.,D,B1,LGD,PREPARATIC24,2016,Junta de Extremadura A1 2015,,,,35,,,,,,Junta de Extremadura A1 2015,,,
"Según el Reglamento de Medidas de Seguridad de Ficheros Automatizados con Datos de Carácter Personal, los ficheros que contengan datos de ideología, religión, creencias, origen racial, salud o vida sexual, ¿qué medidas de seguridad deberán adoptar?",De nivel básico y nivel medio.,De nivel alto.,De nivel medio y nivel alto.,"De nivel básico, nivel medio y nivel alto.",D,B1,LGD,PREPARATIC24,2016,Junta de Extremadura A1 2015,,,,35,,,,,,Junta de Extremadura A1 2015,,,
El proceso de auditoría de sistemas de información se considera como un proceso:,Estratégico,Operativo,Táctico,Tecnológico,A,B1,A.deGrado,PREPARATIC24,2016,AGE A1 2015,,,11866,36,,,,,,AGE A1 2015,,,11866
"Según MAGERIT v3, ¿quiénes son participantes en la tarea PS.2 (Plan de ejecución) para llevar a cabo un Plan de Seguridad?","El equipo de proyecto, especialistas en seguridad y especialistas en áreas específicas de seguridad.",Departamento de desarrollo y departamento de compras.,El equipo de proyecto y personal especializado en la salvaguarda en cuestión.,El director de proyecto y el comité de seguimiento.,B,B1,EMA,PREPARATIC24,2016,AGE A2 2015,,,,36,,,,,,AGE A2 2015,,,
Señale qué dos activos esenciales marcan los requisitos de seguridad para todos los demás componentes del sistema según la metodología Magerit versión 3:,Información y aplicaciones.,Información y servicios.,Aplicaciones e instalaciones.,Información y personal.,B,B1,EMA,PREPARATIC24,2016,AGE A2 2015,,,,36,,,,,,AGE A2 2015,,,
"En el análisis algorítmico descrito en la guía de técnicas de Magerit v3, el coeficiente denominado 'grado de dependencia', es un coeficiente aplicado a las dependencias entre:","activos en el modelo cualitativo, que varía entre 0,0 (activos independientes) y 1,0 (activos con dependencia absoluta).","activos en el modelo cuantitativo, que varía entre 0,0 (activos independientes) y 1,0 (activos con dependencia absoluta).","activos en el modelo cualitativo, que varía entre 0,0 (activos con dependencia absoluta) y 1,0 (activos independientes).","activos en el modelo cuantitativo, que varía entre 0,0 (activos con dependencia absoluta) y 1,0 (activos independientes).",B,B1,EMA,PREPARATIC24,2016,AGE A2 2015,,,,36,,,,,,AGE A2 2015,,,
¿Cuál es la fuente principal para calcular los tiempos estimados de recuperación de las actividades (RTO)?,Plan de Respuesta ante incidentes.,Pruebas de stress.,Plan de Comunicación de crisis.,Análisis de impacto en el negocio.,D,B1,EMA,PREPARATIC24,2016,AGE A2 2015,,,,36,,,,,,AGE A2 2015,,,
El intervalo o la latencia de tiempo entre la última transacción de datos confirmada antes del error y los datos más recientes recuperados después del error se denomina:,Objetivo de tiempo de recuperación (RTO).,Objetivo de punto de recuperación (RPO).,Objetivo de nivel de recuperación (RLO).,Objetivo de datos de recuperación (RDO).,B,B1,EMA,PREPARATIC24,2016,AGE A2 2015,,,,36,,,,,,AGE A2 2015,,,
Los contratos que celebren los poderes adjudicadores se perfeccionan con su:,Ejecución,Adjudicación,Licitación,Formalización,D,B1,A.deGrado,PREPARATIC24,2016,AGE A1 2015,,,11859,37,,,,,,AGE A1 2015,,,11859
Un contrato menor tiene una duración máxima de:,Un año prorrogable,Dos años no prorrogables,Un año no prorrogable,Dos años prorrogables,C,B1,A.deGrado,PREPARATIC24,2016,AGE A1 2015,,,11876,37,,,,,,AGE A1 2015,,,11876
"En un contrato cuyo presupuesto es de 100.000 euros sin IVA y se adjudica por 80.000, IVA excluido, la garantía definitiva será de:",2.400 euros,4.000 euros,3.200 euros,1.600 euros,B,B1,A.deGrado,PREPARATIC24,2016,AGE A1 2015,,,11879,37,,,,,,AGE A1 2015,,,11879
La titularidad de los derechos de explotación de un programa de ordenador por una persona jurídica expirará:,"A los setenta años, computados desde el día siguiente al de su divulgación.","A los cincuenta años, computados desde el día uno de enero del año siguiente al de su divulgación lícita, o al de su creación si no se hubiera divulgado.","A los cincuenta años, computados desde el día siguiente al de su divulgación.","A los setenta años, computados desde el día uno de enero del año siguiente al de su divulgación lícita o al de su creación si no se hubiera divulgado.",D,B1,A.deGrado,PREPARATIC24,2016,AGE A1 2015,,,11872,41,,,,,,AGE A1 2015,,,11872
"Según WCAG 2.0, ¿con qué principio está relacionada la pauta “Hacer que las páginas web aparezcan y operen de forma predecible”?",Perceptible,Operable,Comprensible,Robusto,C,B1,A.deGrado,PREPARATIC24,2016,AGE A1 2015,,,11873,42,,,,,,AGE A1 2015,,,11873
Si quiero desarrollar un sitio web con un diseño adaptativo (responsive web design) con un framework elegiría:,Python.,Euphoria 3.0.,Groovy.,Bootstrap.,D,B1,EMA,PREPARATIC24,2016,AGE A2 2015,,,,42,,,,,,AGE A2 2015,,,
"Dentro de la especificación WAI-ARIA 1.0, ¿cuál de las siguientes opciones es un valor válido para el atributo role?",paragraph,rowtitle,tab,anchor,C,B1,EMA,PREPARATIC24,2016,AGE A2 2015,,,,42,,,,,,AGE A2 2015,,,
"De entre las siguientes, ¿qué herramienta sirve para evaluar la accesibilidad de una Web?",IndieUI: Independent User Interface.,TAW: Test de Accesibilidad Web.,WAI-ARIA: Web Accessibility Initiative - Accessible Rich Internet Applications Suite.,UAAG: User Agent Accessibility Guidelines.,B,B1,EMA,PREPARATIC24,2016,AGE A2 2015,,,,42,,,,,,AGE A2 2015,,,
¿A quién está destinado principalmente las Pautas de Accesibilidad al Contenido en la Web (WCAG)?,A desarrolladores de navegadores web y reproductores multimedia.,"A desarrolladores de herramientas de autor, como herramientas de creación de páginas web o de creación de archivos multimedia.",A desarrolladores de herramientas de evaluación de la accesibilidad web.,Todas las respuestas son correctas.,C,B1,LGD,PREPARATIC24,2016,Junta de Extremadura A1 2015,,,,42,,,,,,Junta de Extremadura A1 2015,,,
"El artículo 16 del Esquema Nacional de Interoperabilidad establece las condiciones de licenciamiento aplicables en el ámbito de la reutilización y transferencia de tecnología, ¿cuál de las siguientes licencias recomienda expresamente aplicar, sin perjuicio de otras licencias que garanticen los derechos expuestos en el mencionado artículo?",ASF-AL (Apache License 2.0),EUPL (European Union Public License),LGPL (Lesser General Public License),MIT(MIT License),B,B1,A.deGrado,PREPARATIC24,2016,AGE A1 2015,,,11822,43,,,,,,AGE A1 2015,,,11822
"En el marco europeo de interoperabilidad de sistemas de información, ¿qué programa de la Unión Europea ha estado en vigor entre 2010 y 2015?",Interchange of Data between Administrations (IDA),Interoperability Solutions for European Public Administrations (ISA),"Interoperable Delivery of Pan-European eGovernment Services to Public Administrations, Businesses and Citizens (IDABC)",Interoperability Electronic European Solution (IEES),B,B1,A.deGrado,PREPARATIC24,2016,AGE A1 2015,,,11874,43,,,,,,AGE A1 2015,,,11874
